{
  "$schema": "./contract.schema.json",
  "contractVersion": "2.0.0",
  "description": "Single source of truth for the BigQuery MCP tool surface, shared by the Python server (bigquery-mcp) and the JS server (bigquery-mcp-js). Both servers MUST expose exactly these tools with these input schemas and produce outputs matching these output schemas. Tool names follow Google's BigQuery MCP / MCP Toolbox conventions (execute_sql, list_dataset_ids, get_dataset_info, list_table_ids, get_table_info); tools with no Google equivalent (dry_run_query, vector_search) are this project's own additions. Tools are ordered cheapest-first to reflect the optimization priority: minimize BigQuery cost (bytes scanned) first, then LLM/token cost, then latency. Edit this file to add or change a tool, then implement the handler on each side.",
  "envelope": {
    "description": "Every tool returns a JSON object. On success: `success: true`, `data`, plus the tool-specific meta fields described in each tool's `output`. On failure: `success: false` with `error` and `error_type`.",
    "error": {
      "type": "object",
      "required": [
        "success",
        "error",
        "error_type"
      ],
      "properties": {
        "success": {
          "const": false
        },
        "error": {
          "type": "string"
        },
        "error_type": {
          "type": "string"
        }
      },
      "additionalProperties": false
    }
  },
  "tools": [
    {
      "name": "list_dataset_ids",
      "summary": "List dataset IDs in the BigQuery project. Metadata-only: no bytes are scanned and no query cost is incurred. Returns names only by default (cheapest for LLM context); set detailed=true for descriptions and table counts. Start data discovery here.",
      "input": {
        "type": "object",
        "additionalProperties": false,
        "properties": {
          "search": {
            "type": "string",
            "default": "",
            "description": "Filter datasets by name (case-insensitive)"
          },
          "detailed": {
            "type": "boolean",
            "default": false,
            "description": "Include descriptions and table counts for each dataset"
          },
          "max_results": {
            "type": [
              "integer",
              "null"
            ],
            "default": null,
            "description": "(OPTIONAL INTEGER) Maximum number of datasets to return"
          }
        }
      },
      "output": {
        "type": "object",
        "additionalProperties": true,
        "required": [
          "success",
          "data",
          "total_available",
          "total_matching",
          "returned_count"
        ],
        "properties": {
          "success": {
            "const": true
          },
          "data": {
            "type": "array",
            "description": "Array of dataset id strings (basic) or dataset objects (detailed)."
          },
          "total_available": {
            "type": "integer"
          },
          "total_matching": {
            "type": "integer"
          },
          "returned_count": {
            "type": "integer"
          }
        }
      }
    },
    {
      "name": "get_dataset_info",
      "summary": "Get metadata for a single BigQuery dataset (description, location, labels, default table expiration, table count). Metadata-only: no bytes are scanned and no query cost is incurred.",
      "input": {
        "type": "object",
        "additionalProperties": false,
        "required": [
          "dataset_id"
        ],
        "properties": {
          "dataset_id": {
            "type": "string",
            "description": "Dataset ID to get metadata for"
          }
        }
      },
      "output": {
        "type": "object",
        "additionalProperties": true,
        "required": [
          "success",
          "data"
        ],
        "properties": {
          "success": {
            "const": true
          },
          "data": {
            "type": "object",
            "required": [
              "dataset_id",
              "table_count"
            ],
            "properties": {
              "dataset_id": {
                "type": "string"
              },
              "friendly_name": {
                "type": [
                  "string",
                  "null"
                ]
              },
              "description": {
                "type": [
                  "string",
                  "null"
                ]
              },
              "location": {
                "type": [
                  "string",
                  "null"
                ]
              },
              "created": {
                "type": [
                  "string",
                  "null"
                ]
              },
              "modified": {
                "type": [
                  "string",
                  "null"
                ]
              },
              "default_table_expiration_ms": {
                "type": [
                  "integer",
                  "null"
                ]
              },
              "labels": {
                "type": [
                  "object",
                  "null"
                ]
              },
              "table_count": {
                "type": "integer"
              }
            }
          }
        }
      }
    },
    {
      "name": "list_table_ids",
      "summary": "List table IDs in a dataset. Metadata-only: no bytes are scanned and no query cost is incurred. Returns names only by default (cheapest for LLM context); set detailed=true for row counts and sizes.",
      "input": {
        "type": "object",
        "additionalProperties": false,
        "required": [
          "dataset_id"
        ],
        "properties": {
          "dataset_id": {
            "type": "string",
            "description": "Dataset ID to list tables from"
          },
          "search": {
            "type": "string",
            "default": "",
            "description": "Filter tables by name (case-insensitive)"
          },
          "detailed": {
            "type": "boolean",
            "default": false,
            "description": "Include table metadata like row count and size"
          },
          "max_results": {
            "type": [
              "integer",
              "null"
            ],
            "default": null,
            "description": "(OPTIONAL INTEGER) Maximum number of tables to return"
          }
        }
      },
      "output": {
        "type": "object",
        "additionalProperties": true,
        "required": [
          "success",
          "data",
          "total_available",
          "total_matching",
          "returned_count",
          "dataset_context"
        ],
        "properties": {
          "success": {
            "const": true
          },
          "data": {
            "type": "array",
            "description": "Array of table id strings (basic) or table objects (detailed)."
          },
          "total_available": {
            "type": "integer"
          },
          "total_matching": {
            "type": "integer"
          },
          "returned_count": {
            "type": "integer"
          },
          "dataset_context": {
            "type": "object",
            "required": [
              "dataset_id",
              "total_table_count"
            ],
            "properties": {
              "dataset_id": {
                "type": "string"
              },
              "description": {
                "type": [
                  "string",
                  "null"
                ]
              },
              "location": {
                "type": [
                  "string",
                  "null"
                ]
              },
              "total_table_count": {
                "type": "integer"
              }
            }
          }
        }
      }
    },
    {
      "name": "get_table_info",
      "summary": "Get a table's schema, metadata, per-column fill rates, and a few sample rows. Use this to judge a table's relevance before writing a query. Cost note: fill-rate and sample-row probes scan only a small bounded sample and are capped by max_bytes_billed.",
      "input": {
        "type": "object",
        "additionalProperties": false,
        "required": [
          "dataset_id",
          "table_id"
        ],
        "properties": {
          "dataset_id": {
            "type": "string",
            "description": "Dataset ID containing the table"
          },
          "table_id": {
            "type": "string",
            "description": "Table ID to get detailed information for"
          }
        }
      },
      "output": {
        "type": "object",
        "additionalProperties": true,
        "required": [
          "success",
          "data"
        ],
        "properties": {
          "success": {
            "const": true
          },
          "data": {
            "type": "object",
            "required": [
              "table_path",
              "type",
              "schema_with_fill_rates",
              "sample_data"
            ],
            "properties": {
              "table_path": {
                "type": "string"
              },
              "type": {
                "type": "string"
              },
              "description": {
                "type": [
                  "string",
                  "null"
                ]
              },
              "total_row_count": {
                "type": [
                  "integer",
                  "null"
                ]
              },
              "size_bytes": {
                "type": [
                  "integer",
                  "null"
                ]
              },
              "created": {
                "type": [
                  "string",
                  "null"
                ]
              },
              "modified": {
                "type": [